{"data":{"mdx":{"code":{"body":"function _extends() { _extends = Object.assign || function (target) { for (var i = 1; i < arguments.length; i++) { var source = arguments[i]; for (var key in source) { if (Object.prototype.hasOwnProperty.call(source, key)) { target[key] = source[key]; } } } return target; }; return _extends.apply(this, arguments); }\n\nfunction _objectWithoutProperties(source, excluded) { if (source == null) return {}; var target = _objectWithoutPropertiesLoose(source, excluded); var key, i; if (Object.getOwnPropertySymbols) { var sourceSymbolKeys = Object.getOwnPropertySymbols(source); for (i = 0; i < sourceSymbolKeys.length; i++) { key = sourceSymbolKeys[i]; if (excluded.indexOf(key) >= 0) continue; if (!Object.prototype.propertyIsEnumerable.call(source, key)) continue; target[key] = source[key]; } } return target; }\n\nfunction _objectWithoutPropertiesLoose(source, excluded) { if (source == null) return {}; var target = {}; var sourceKeys = Object.keys(source); var key, i; for (i = 0; i < sourceKeys.length; i++) { key = sourceKeys[i]; if (excluded.indexOf(key) >= 0) continue; target[key] = source[key]; } return target; }\n\n/* @jsx mdx */\nvar heading = ['Name(s)', 'PoC Area', 'SME(s)'];\nvar data = [{\n  name: 'Jayant,Sumit',\n  area: 'Block Chain',\n  sme: 'Maniappan/Senthil'\n}, {\n  name: 'Madanlal, Dhruv + 1',\n  area: 'Block Chain',\n  sme: 'Maniappan/Senthil'\n}, {\n  name: 'Murugesh Paneerdurai',\n  area: 'Block Chain',\n  sme: 'Maniappan/Senthil'\n}, {\n  name: 'Bala Vijay and Aravind',\n  area: 'GPU Computing',\n  sme: 'Senthil'\n}, {\n  name: 'Tarun Kukreja',\n  area: 'Machine Learning',\n  sme: 'Kinnar/Ritesh'\n}, {\n  name: 'Bishnu',\n  area: 'Micro Services',\n  sme: 'Maniappan/Tarun'\n}, {\n  name: 'Amit Kumar Goyal',\n  area: 'Micro Services',\n  sme: 'Maniappan/Tarun'\n}, {\n  name: 'Manikandan S',\n  area: 'Micro Services',\n  sme: 'Maniappan/Tarun'\n}, {\n  name: 'Begin Samuel',\n  area: 'Micro Services or Serverless Computing',\n  sme: 'Maniappan/Tarun'\n}, {\n  name: 'Pankaj Singh',\n  area: 'MLDL',\n  sme: 'Kinnar/Ritesh'\n}, {\n  name: 'Apoorva Kanchan',\n  area: 'MLDL',\n  sme: 'Kinnar/Ritesh'\n}, {\n  name: 'Daljeet',\n  area: 'MLDL',\n  sme: 'Kinnar'\n}, {\n  name: 'Seshumani, Nitin Jain',\n  area: 'Node JS (Full Stack with Micro frontends)',\n  sme: 'Tarun'\n}, {\n  name: 'Madanlal, Dhruv + 1',\n  area: 'React',\n  sme: 'Tarun'\n}, {\n  name: 'Suresh K',\n  area: 'Serverless computing',\n  sme: 'Maniappan/Tarun'\n}, {\n  name: 'Nilay Tiwari',\n  area: 'Serverless computing',\n  sme: 'Maniappan/Tarun'\n}, {\n  name: 'P Praveen',\n  area: 'Serverless computing',\n  sme: 'Maniappan/Tarun'\n}, {\n  name: 'Shrwan Kumar',\n  area: 'Serverless computing or Voice Apps',\n  sme: 'Senthil'\n}, {\n  name: 'Kuldeep Singh',\n  area: 'Voice Apps - Quiz framework',\n  sme: 'Senthil/Kinnar'\n}];\nvar _frontmatter = {\n  \"title\": \"Welcome to PoC2020!\",\n  \"date\": \"2019-13-05\",\n  \"tags\": \"poc,2020,open source\",\n  \"image\": \"/images/poc-2020.png\",\n  \"heroImage\": \"/images/poc-2020.png\",\n  \"heroHeading\": \"PoC 2020 is now open!\",\n  \"heroSubHeading\": \"ERS Technology Office\",\n  \"heroTextColor\": \"darkslategray\",\n  \"excerpt\": \"PoC 2020 Challenge is open now!\"\n};\n\nvar makeShortcode = function makeShortcode(name) {\n  return function MDXDefaultShortcode(props) {\n    console.warn(\"Component \" + name + \" was not imported, exported, or provided by MDXProvider as global scope\");\n    return mdx(\"div\", props);\n  };\n};\n\nvar layoutProps = {\n  _frontmatter: _frontmatter\n};\nvar MDXLayout = \"wrapper\";\nreturn function MDXContent(_ref) {\n  var components = _ref.components,\n      props = _objectWithoutProperties(_ref, [\"components\"]);\n\n  return mdx(MDXLayout, _extends({}, layoutProps, props, {\n    components: components,\n    mdxType: \"MDXLayout\"\n  }), mdx(\"hr\", null), mdx(\"h2\", null, \"Introduction\"), mdx(\"p\", null, mdx(\"strong\", {\n    parentName: \"p\"\n  }, \"Purpose\"), \" of this contest is to develop capability, identify and make reusable components and, where possible, use it in customer demos.\"), mdx(\"h2\", null, \"Timeline\"), mdx(\"ul\", null, mdx(\"li\", {\n    parentName: \"ul\"\n  }, \"Two to Three months\"), mdx(\"li\", {\n    parentName: \"ul\"\n  }, \"Demo and evaluation at the end of the project\")), mdx(\"h2\", null, \"Evaluation\"), mdx(\"ul\", null, mdx(\"li\", {\n    parentName: \"ul\"\n  }, \"A panel would evaluate at the end\"), mdx(\"li\", {\n    parentName: \"ul\"\n  }, \"There would be a recommendation/nomination for award based on the evaluation outcome\")), mdx(\"h2\", null, \"Participation\"), mdx(\"ul\", null, mdx(\"li\", {\n    parentName: \"ul\"\n  }, \"You can participate as an individual or team (not more than 3 in a group)\"), mdx(\"li\", {\n    parentName: \"ul\"\n  }, \"Guides/Mentors will explain project/guide you through in case of need (after registering for the PoC)\")), mdx(\"hr\", null), mdx(\"h2\", null, \"Proof of Concept Project List\"), mdx(\"p\", null, \"The list of PoCs from which you can choose are:\"), mdx(\"h3\", null, \"Microservices\"), mdx(\"ul\", null, mdx(\"li\", {\n    parentName: \"ul\"\n  }, \"The Microservice projects can be in any one of the following areas (but not limited to)\", mdx(\"ul\", {\n    parentName: \"li\"\n  }, mdx(\"li\", {\n    parentName: \"ul\"\n  }, \"Application auto-scaling instrumentation and orchestration.\"), mdx(\"li\", {\n    parentName: \"ul\"\n  }, \"CQRS / ES Implementation - either using an existing framework or creating your own implementation. The two most comprehensive ones here include the Axon Framework and Lagom. Also look at SpringBoot with Akka.\", mdx(\"ul\", {\n    parentName: \"li\"\n  }, mdx(\"li\", {\n    parentName: \"ul\"\n  }, \"Reference Links : \", mdx(\"a\", _extends({\n    parentName: \"li\"\n  }, {\n    \"href\": \"https://github.com/Romeh/spring-boot-akka-event-sourcing-starter\"\n  }), \"https://github.com/Romeh/spring-boot-akka-event-sourcing-starter\"), \", \", mdx(\"a\", _extends({\n    parentName: \"li\"\n  }, {\n    \"href\": \"https://docs.axoniq.io/reference-guide/quick-start\"\n  }), \"https://docs.axoniq.io/reference-guide/quick-start\"), \", \", mdx(\"a\", _extends({\n    parentName: \"li\"\n  }, {\n    \"href\": \"https://www.youtube.com/watch?v=cISNDnwlSgw&list=WL\"\n  }), \"https://www.youtube.com/watch?v=cISNDnwlSgw&list=WL\")))), mdx(\"li\", {\n    parentName: \"ul\"\n  }, \"Consumer Driven Contracts for Microservices - Leverage CDC frameworks like Spring Cloud Contract , Pact\"), mdx(\"li\", {\n    parentName: \"ul\"\n  }, \"Monolith to Microservices using DDD - demonstrate this in an end to end project covering the stages of conversion using DDD concepts and principles\"), mdx(\"li\", {\n    parentName: \"ul\"\n  }, \"JHipster based microservices implementation with deployment on AWS containers\"), mdx(\"li\", {\n    parentName: \"ul\"\n  }, \"Microservice orchestration workflow solution based on any framework or custom solution - Zeebe , Camunda, Activiti or any other.\")))), mdx(\"h3\", null, \"Serverless Computing\"), mdx(\"ul\", null, mdx(\"li\", {\n    parentName: \"ul\"\n  }, \"Framework of application to run on AWS Lambda and Azure Service Fabric with minimal porting.\"), mdx(\"li\", {\n    parentName: \"ul\"\n  }, \"Applicable for MultiCloud strategy in long term.\"), mdx(\"li\", {\n    parentName: \"ul\"\n  }, \"Event Driven, Stateless, Single Purpose , Asynchronous , Scale by request\"), mdx(\"li\", {\n    parentName: \"ul\"\n  }, \"The Serverless projects can be in any one of the following areas (but not limited to)\", mdx(\"ul\", {\n    parentName: \"li\"\n  }, mdx(\"li\", {\n    parentName: \"ul\"\n  }, \"Using a Serverless framework like Serverless , Serverless Express, AWS SAM (Automation for Provisioning) , Laconia, Claudia etc.\"), mdx(\"li\", {\n    parentName: \"ul\"\n  }, \"Contact Us Forms - with notifications\"), mdx(\"li\", {\n    parentName: \"ul\"\n  }, \"URL Shortner\"), mdx(\"li\", {\n    parentName: \"ul\"\n  }, \"Notification System with user subscriptions and notifications\"), mdx(\"li\", {\n    parentName: \"ul\"\n  }, \"GraphQL Server with subscriptions for a newsfeed\"), mdx(\"li\", {\n    parentName: \"ul\"\n  }, \"AWS Lambda offline / local development and testing solution\"), mdx(\"li\", {\n    parentName: \"ul\"\n  }, \"Demonstrate separation of the serverless handler vs domain logic so that we can avoid vendor lockin\"), mdx(\"li\", {\n    parentName: \"ul\"\n  }, \"Create a Serverless implementation with AWS Lambda and the Serverless framework to demonstrate the pros and cons. Is it worth the overhead to use a wrapper framework like Serverless vs native AWS Lambda , just to avoid vendor lockin . Also whats the cost of migration from AWS Lambda\"), mdx(\"li\", {\n    parentName: \"ul\"\n  }, \"Kubernetes Serverless framework Fission.io based Serverless usecase implementation\"), mdx(\"li\", {\n    parentName: \"ul\"\n  }, \"Look at all aspects like Architecture, Security, Tools , Housekeeping , Operations, Cost\"), mdx(\"li\", {\n    parentName: \"ul\"\n  }, \"Look at practical aspects - debugging, rollback, latency (code start), staging to production architecture, how to cleanup and do housekeeping.\"), mdx(\"li\", {\n    parentName: \"ul\"\n  }, \"Practial Amazon Serverless principles: Amazon has no SLA for lambda. Look at aspects like event injection, how to control billing, billing alerts, security scanning, concurrency limits,  setting up security policies\"), mdx(\"li\", {\n    parentName: \"ul\"\n  }, \"Serverless patterns - One lambda with dispatch, Multi lambda with shared code, Multi lambda with share nothing\", mdx(\"ul\", {\n    parentName: \"li\"\n  }, mdx(\"li\", {\n    parentName: \"ul\"\n  }, mdx(\"strong\", {\n    parentName: \"li\"\n  }, \"One Lambda with dispatch\"), \" - One lambda calling multiple backend APIs\"), mdx(\"li\", {\n    parentName: \"ul\"\n  }, mdx(\"strong\", {\n    parentName: \"li\"\n  }, \"Multiple Lambda with shared code\"), \" - Copies of the sample Lambda deployed one for each API / service\"), mdx(\"li\", {\n    parentName: \"ul\"\n  }, mdx(\"strong\", {\n    parentName: \"li\"\n  }, \"Multple Lambda with share nothing\"), \" - Totally separate Lambdas deployed with share nothing and one for each API / service\"))), mdx(\"li\", {\n    parentName: \"ul\"\n  }, \"Runtime choice is open - Node JS, Java , Kotlin , .NET etc.  \")))), mdx(\"h3\", null, \"Block Chain\"), mdx(\"ul\", null, mdx(\"li\", {\n    parentName: \"ul\"\n  }, mdx(\"p\", {\n    parentName: \"li\"\n  }, \"The Block Chain projects can be in any one of the following areas (but not limited to)\")), mdx(\"li\", {\n    parentName: \"ul\"\n  }, mdx(\"ol\", {\n    parentName: \"li\"\n  }, mdx(\"li\", {\n    parentName: \"ol\"\n  }, \"Design files changes tracked and managed using Blockchain \"))), mdx(\"li\", {\n    parentName: \"ul\"\n  }, mdx(\"ol\", _extends({\n    parentName: \"li\"\n  }, {\n    \"start\": 2\n  }), mdx(\"li\", {\n    parentName: \"ol\"\n  }, mdx(\"p\", {\n    parentName: \"li\"\n  }, \"Ethereum based Smart Contract for P2P Car rental\")), mdx(\"li\", {\n    parentName: \"ol\"\n  }, mdx(\"p\", {\n    parentName: \"li\"\n  }, mdx(\"strong\", {\n    parentName: \"p\"\n  }, \"Name:\"), \" 1. Blockchain based trusted assets exchange platform\"), mdx(\"ul\", {\n    parentName: \"li\"\n  }, mdx(\"li\", {\n    parentName: \"ul\"\n  }, mdx(\"strong\", {\n    parentName: \"li\"\n  }, \"Objective :\"), \" Build a platform that enables trusted exchange of assets namely 3D printing design files between various users of these files. User who orders for manufacturing of a 3D object enters into a contract with the manufacturer and provides the specification. The manufacturer in turn hires a design engineer who models the object and provides a draft for approval. Based on the approval of the design the manufacturer generates intermediate files that will be fed into the printer for manufacturing the object. This platform ensures that the files are shared in a trustful manner between the three actors(Buyer, Designer, Manufacturer). \"), mdx(\"li\", {\n    parentName: \"ul\"\n  }, mdx(\"strong\", {\n    parentName: \"li\"\n  }, \"Justification :\"), \" The 3D design files are typically stored in .stl format. This contains the binary representation of the design of the object to be manufactured and is susceptible to changes that can be involuntary as well as malicious. To prevent this each of the file can be embedded with an unique watermark. This can be stored as an immutable block in the blockchain along with the signature of the file, timestamp, size, version of file and the actor who modified the file when it was versioned. Consumer of the file can validate the same using it further using the details available in the blockchain. \"), mdx(\"li\", {\n    parentName: \"ul\"\n  }, mdx(\"strong\", {\n    parentName: \"li\"\n  }, \"Suggested Implementation :\"), \" There are multiple blockchain implementation available, both public and enterprise private permissioned implementations. One such Enterprise grade private permissioned implementation is BigchainDB that is planned to be used for this implementation. This uses MongoDB store internally to persist the blocks and uses the Tendermint as the consensus algorithm.\"), mdx(\"li\", {\n    parentName: \"ul\"\n  }, mdx(\"strong\", {\n    parentName: \"li\"\n  }, \"Rationale :\"), \" We have a customer who is interested in having this implementation as part of their medical device manufacturing workflow to ensure that the regulatory compliance of providing a trusted exchange is fulfilled. This can be extended for different types of assets(audio, video, legal PDF documents etc. ). \"))), mdx(\"li\", {\n    parentName: \"ol\"\n  }, mdx(\"p\", {\n    parentName: \"li\"\n  }, mdx(\"strong\", {\n    parentName: \"p\"\n  }, \"Name:\"), \" 2. Ethereum based Smart Contract for P2P Car rental        \"), mdx(\"ul\", {\n    parentName: \"li\"\n  }, mdx(\"li\", {\n    parentName: \"ul\"\n  }, mdx(\"p\", {\n    parentName: \"li\"\n  }, mdx(\"strong\", {\n    parentName: \"p\"\n  }, \"Objective :\"), \" Current P2P Vehicle rental models use centralized approach where companies like turo / getaround acts as the middlemen. Using these platforms , one can list their vehicles for rentals and the platform takes a cut from the rental cost. As an alternate to this centralized approach, leverage Smart contracts on a Blockchain to coordinate this process between the provider and consumer. This contract would ensure the deposit, total cost and rental duration are met as per contract and if any disputes the transactions in the block can be used for any legal verification.\")), mdx(\"li\", {\n    parentName: \"ul\"\n  }, mdx(\"p\", {\n    parentName: \"li\"\n  }, mdx(\"strong\", {\n    parentName: \"p\"\n  }, \"Justification :\"), \" Typical rental contract contains the consumer, provider, rental duration, deposit and daily rental rates. Smart contract maintains the immutable global state of these key values and expose APIs for the end user app to interact with the Contract. Provider and Consumer can share the public Blockchain transaction execution cost (example Ethereum gas cost) which would be relatively lesser compared to the cut taken out by the centralized platforms. These contracts also provides total transparency since all the events and associated states are recorded on the global network storage and at the same time ensures privacy since cryptographic keys are used to identify the parties.\")), mdx(\"li\", {\n    parentName: \"ul\"\n  }, mdx(\"p\", {\n    parentName: \"li\"\n  }, mdx(\"strong\", {\n    parentName: \"p\"\n  }, \"Suggested Implementation :\"), \" Develop a Ethereum based smart contract using Truffle, web3js and Ethereum TestNet (MainNet need real ETH). Develop a Web/Mobile App which can instantiate the contract, associate the provider/consumer and trigger events. This Web app would also provide a simple DB (offchain) to browse for vehicles and start the transaction.\")), mdx(\"li\", {\n    parentName: \"ul\"\n  }, mdx(\"p\", {\n    parentName: \"li\"\n  }, mdx(\"strong\", {\n    parentName: \"p\"\n  }, \"Rationale :\"), \" The primary purpose of this PoC is to develop capability in Smart contract development, understand how to estimate the transaction costs, challenges in operationalizing the same. This solution can be extended to any requirement where the middleman cost need to be eliminated (example Real estate Escrows).\"))))))), mdx(\"h3\", null, \"GPU Computing\"), mdx(\"ul\", null, mdx(\"li\", {\n    parentName: \"ul\"\n  }, \"Using GPU in number crunching algorithm/activities using standard programming frameworks\"), mdx(\"li\", {\n    parentName: \"ul\"\n  }, \"Ability to identify the GPU offloads in any given problem, model the solution and develop code to run the solution on the GPU infrastructure (single chip or a large cluster)\"), mdx(\"li\", {\n    parentName: \"ul\"\n  }, \"Find shortest path for a delivery route using low level CUDA programming with adjacent matrices.\"), mdx(\"li\", {\n    parentName: \"ul\"\n  }, \"There are high level frameworks (GraphQL) and Cloud APIs, but the idea is to develop capability in GPU\")), mdx(\"h3\", null, \"Programming using CUDA\"), mdx(\"ul\", null, mdx(\"li\", {\n    parentName: \"ul\"\n  }, \"Develop capability in developing / migrating solutions to native GPU databases (example BlazingSQL, Kinetica, Sqream )\")), mdx(\"h3\", null, \"ML/DL\"), mdx(\"ul\", null, mdx(\"li\", {\n    parentName: \"ul\"\n  }, \"Build Component using Weibull Analysis for estimating Remaining Useful Life of an asset.\"), mdx(\"li\", {\n    parentName: \"ul\"\n  }, \"Creating reusable solution from a TKT auto assignation system end to end pipeline for deploying a ML/DL model including model scores etc\"), mdx(\"li\", {\n    parentName: \"ul\"\n  }, \"The ML/DL projects can be in any one of the following areas (but not limited to)\", mdx(\"ul\", {\n    parentName: \"li\"\n  }, mdx(\"li\", {\n    parentName: \"ul\"\n  }, \"End to end pipeline for deploying a ML/DL model in production including model scores.\", mdx(\"ul\", {\n    parentName: \"li\"\n  }, mdx(\"li\", {\n    parentName: \"ul\"\n  }, mdx(\"strong\", {\n    parentName: \"li\"\n  }, \"Objectives\"), mdx(\"ul\", {\n    parentName: \"li\"\n  }, mdx(\"li\", {\n    parentName: \"ul\"\n  }, \"Develop AIOps capability and use cases.\", mdx(\"ol\", {\n    parentName: \"li\"\n  }, mdx(\"li\", {\n    parentName: \"ol\"\n  }, \"Data Preparation and Model Training\"), mdx(\"li\", {\n    parentName: \"ol\"\n  }, \"ML/DL models when deployed in production often decay over time how to maintain quality of model\"), mdx(\"li\", {\n    parentName: \"ol\"\n  }, \"Implement optimized I/O pipeline of ML/DL\"), mdx(\"li\", {\n    parentName: \"ol\"\n  }, \"Develop seamless REST API on top of model which would not be affected when the live model is changed in Realtime.\"), mdx(\"li\", {\n    parentName: \"ol\"\n  }, \"The system should be horizontally scalable and would not slow down inference rate when the load increases. \"), mdx(\"li\", {\n    parentName: \"ol\"\n  }, \"Monitor predictions \"), mdx(\"li\", {\n    parentName: \"ol\"\n  }, \"Secure model\"))))), mdx(\"li\", {\n    parentName: \"ul\"\n  }, mdx(\"strong\", {\n    parentName: \"li\"\n  }, \"Justification\"), \" \", mdx(\"ul\", {\n    parentName: \"li\"\n  }, mdx(\"li\", {\n    parentName: \"ul\"\n  }, \"AI is about 10% modelling and 90% engineering. Not every AI concept result in a successful product, nor every model deployed in production is successful too. A pipeline helps in experimentation and in seamless deployment of a model with greater ROI.\"))), mdx(\"li\", {\n    parentName: \"ul\"\n  }, mdx(\"strong\", {\n    parentName: \"li\"\n  }, \"Suggested Implementation\"), \" \", mdx(\"ul\", {\n    parentName: \"li\"\n  }, mdx(\"li\", {\n    parentName: \"ul\"\n  }, \"Need to break down the components into parts. TFX is a very good start \", mdx(\"a\", _extends({\n    parentName: \"li\"\n  }, {\n    \"href\": \"https://www.tensorflow.org/tfx\"\n  }), \"https://www.tensorflow.org/tfx\"), \" we need to extend from here as required. \"))), mdx(\"li\", {\n    parentName: \"ul\"\n  }, mdx(\"strong\", {\n    parentName: \"li\"\n  }, \"Rationale\"), \" \", mdx(\"ul\", {\n    parentName: \"li\"\n  }, mdx(\"li\", {\n    parentName: \"ul\"\n  }, \"Customers are already asking us these questions. We can offer to enhance their existing Big Data platform with this implementation. The nuances of deployment of ML/DL models in production needs to be understood and this would give us this opportunity. Given the heterogenous environments where the models are deployed cloud/edge/on-premise it\\u2019s important we get a complete understanding of the complexities involved. \"), mdx(\"li\", {\n    parentName: \"ul\"\n  }, \"Ref : \", mdx(\"a\", _extends({\n    parentName: \"li\"\n  }, {\n    \"href\": \"https://eng.uber.com/michelangelo/\"\n  }), \"https://eng.uber.com/michelangelo/\"), \" \"))))), mdx(\"li\", {\n    parentName: \"ul\"\n  }, \"Develop a speech-based application to explore data, create reports and charts etc.\", mdx(\"ul\", {\n    parentName: \"li\"\n  }, mdx(\"li\", {\n    parentName: \"ul\"\n  }, mdx(\"strong\", {\n    parentName: \"li\"\n  }, \"Objectives\"), \"  \", mdx(\"ul\", {\n    parentName: \"li\"\n  }, mdx(\"li\", {\n    parentName: \"ul\"\n  }, \"Develop an Augmented Analytics Application which would respond to speech commands and \", mdx(\"ul\", {\n    parentName: \"li\"\n  }, mdx(\"li\", {\n    parentName: \"ul\"\n  }, \"search /explore data\"), mdx(\"li\", {\n    parentName: \"ul\"\n  }, \"create reports/charts\"), mdx(\"li\", {\n    parentName: \"ul\"\n  }, \"develop insights \"), mdx(\"li\", {\n    parentName: \"ul\"\n  }, \"learn \"))))), mdx(\"li\", {\n    parentName: \"ul\"\n  }, mdx(\"strong\", {\n    parentName: \"li\"\n  }, \"Justification\"), \" \", mdx(\"ul\", {\n    parentName: \"li\"\n  }, mdx(\"li\", {\n    parentName: \"ul\"\n  }, \"Mozilla Deep Learning is one the most advanced and easy to use speech recognition library. We can integrate this with simple python APIs to build a knowledgebase using Neo4j etc. MYSQL code constructs can be generated using rule-based approach using the knowledge base etc.        Metadata about the data can be mined into the knowledgebase using tools like \", mdx(\"a\", _extends({\n    parentName: \"li\"\n  }, {\n    \"href\": \"https://neo4j-contrib.github.io/neo4j-apoc-procedures/#_load_jdbc\"\n  }), \"https://neo4j-contrib.github.io/neo4j-apoc-procedures/#_load_jdbc\"), \" \"))), mdx(\"li\", {\n    parentName: \"ul\"\n  }, mdx(\"strong\", {\n    parentName: \"li\"\n  }, \"Suggested Implementation\"), \" \", mdx(Image, {\n    imageName: \"ml-dl-speech-app\",\n    bypassImage: true,\n    mdxType: \"Image\"\n  })), mdx(\"li\", {\n    parentName: \"ul\"\n  }, mdx(\"strong\", {\n    parentName: \"li\"\n  }, \"Rationale\"), \" \", mdx(\"ul\", {\n    parentName: \"li\"\n  }, mdx(\"li\", {\n    parentName: \"ul\"\n  }, \"Augmented Analytics Is the Future of Data and Analytics. Augmented analytics, an approach that automates insights using machine learning and natural-language generation, marks the next wave of disruption in the data and analytics market.\"), mdx(\"li\", {\n    parentName: \"ul\"\n  }, mdx(\"a\", _extends({\n    parentName: \"li\"\n  }, {\n    \"href\": \"https://www.gartner.com/en/conferences/apac/data-analytics-australia/why-attend/event-resources/research-augmented-analytics\"\n  }), \"https://www.gartner.com/en/conferences/apac/data-analytics-australia/why-attend/event-resources/research-augmented-analytics\"))))))))), mdx(\"h3\", null, \"Voice Apps\"), mdx(\"ul\", null, mdx(\"li\", {\n    parentName: \"ul\"\n  }, \"To enable Voice as another channel for any use cases using native frameworks / cloud / existing assistant integration (like Alexa)\"), mdx(\"li\", {\n    parentName: \"ul\"\n  }, \"Develop a Quiz framework where one can upload a set of Questions / Answer choices / Right answer in JSON format and framework automatically depoys the Quiz for consumption on a Voice assistant platform (example Alexa)\"), mdx(\"li\", {\n    parentName: \"ul\"\n  }, \"Develop a speech based application to explore data, create reports and charts etc.\")), mdx(\"h3\", null, \"Full Stack Node JS (with Microfrontends)\"), mdx(\"ul\", null, mdx(\"li\", {\n    parentName: \"ul\"\n  }, \"Node JS microservice solution using \", mdx(\"a\", _extends({\n    parentName: \"li\"\n  }, {\n    \"href\": \"https://nestjs.com/\"\n  }), \"Nest JS\"), \" , \", mdx(\"a\", _extends({\n    parentName: \"li\"\n  }, {\n    \"href\": \"https://github.com/ERS-HCL/nxplorerjs-microservice-starter\"\n  }), \"NxplorerJS\"), \" or any other as the core Node JS framework. \"), mdx(\"li\", {\n    parentName: \"ul\"\n  }, \"This should be implemented as a micro-frontend solution. \"), mdx(\"li\", {\n    parentName: \"ul\"\n  }, \"Atleast 2 (nodeJS) microservices that have their own micro front end that are either linked or use custom Events.\"), mdx(\"li\", {\n    parentName: \"ul\"\n  }, \"Which means this is a full stack implementation \\u2013 from UI to backend. \"), mdx(\"li\", {\n    parentName: \"ul\"\n  }, \"The frontend could be using an App shell (that connects the two micro-front ends) or a UI micro-apps are connected via http links for transition.\"), mdx(\"li\", {\n    parentName: \"ul\"\n  }, \"You can explore existing microfrontend solutions like \", mdx(\"a\", _extends({\n    parentName: \"li\"\n  }, {\n    \"href\": \"https://www.mosaic9.org/\"\n  }), \"mosaic\"), \" , \", mdx(\"a\", _extends({\n    parentName: \"li\"\n  }, {\n    \"href\": \"https://github.com/SAP/luigi\"\n  }), \"SAP - luigi\"), \", \", mdx(\"a\", _extends({\n    parentName: \"li\"\n  }, {\n    \"href\": \"https://single-spa.js.org/\"\n  }), \"SingleSPA\"), \", \", mdx(\"a\", _extends({\n    parentName: \"li\"\n  }, {\n    \"href\": \"https://github.com/unsafecode/react-microfrontends-demo\"\n  }), \"React microfrontends\"), \" or any other framework.\"), mdx(\"li\", {\n    parentName: \"ul\"\n  }, \"The UI technology for the micro-frontend can be any of the following but not limited to - React, Vue , Angular.\")), mdx(\"h3\", null, \"React - Design System\"), mdx(\"ul\", null, mdx(\"li\", {\n    parentName: \"ul\"\n  }, \"A show case project that uses Atomic Library components and ready to use page templates built using this library\"), mdx(\"li\", {\n    parentName: \"ul\"\n  }, \"This should be implemented as a separate component library that is leveraged in a demoable React application\"), mdx(\"li\", {\n    parentName: \"ul\"\n  }, \"Technology for the UI framework can CSS or CSS in JS based.\"), mdx(\"li\", {\n    parentName: \"ul\"\n  }, \"The technology choices and architecture should cater to the overall UI performance aspects.\"), mdx(\"li\", {\n    parentName: \"ul\"\n  }, \"The demoable React application could be either client side or server side rendered\"), mdx(\"li\", {\n    parentName: \"ul\"\n  }, \"The design system should have a demoable style guide using tools like Storybook , Styleguidist, docz\"), mdx(\"li\", {\n    parentName: \"ul\"\n  }, \"The projects comply with ES6 coding standards\"), mdx(\"li\", {\n    parentName: \"ul\"\n  }, \"As a starting point the \", mdx(\"a\", _extends({\n    parentName: \"li\"\n  }, {\n    \"href\": \"https://github.com/ERS-HCL/react-atomic-lib\"\n  }), \"react-atomic-lib\"), \" could be used as a reference. You can fork the project if you want to use this project as a starting point. Otherwise you are free to create your own implementation of use any other framework.\"), mdx(\"li\", {\n    parentName: \"ul\"\n  }, \"The language choices open - JavaScript or Typescript based implementations\")), mdx(\"h3\", null, \"Project Teams\"), mdx(TableComponent, {\n    heading: heading,\n    data: data,\n    mdxType: \"TableComponent\"\n  }));\n}\nMDXContent.isMDXComponent = true;"},"frontmatter":{"title":"Welcome to PoC2020!","author":null,"heroImage":"/images/poc-2020.png","heroHeading":"PoC 2020 is now open!","heroSubHeading":"ERS Technology Office","heroTextColor":"darkslategray"}}},"pageContext":{"isCreatedByStatefulCreatePages":false,"slug":"/posts/poc-2020/"}}